<?xml version="1.0" encoding="UTF-8" standalone="no"?>
<!DOCTYPE films SYSTEM "films.dtd">
<!-- Insert SYSTEM DOCTYPE-->
<films>
    <film id="F1" maker="FM1">
            <!-- Non se pode poñer unicamente número, ten que ter unha letra antes, senon da erro-->
        <name>Forest Gump</name>
    </film>
    <film id="F2" maker="FM2">
        <name>War of the worlds</name>
    </film>
    <film id="F3" maker="FM3">
        <name>American psyco</name>
    </film>
    <filmmaker id="FM1">
        <name>Robert Zemeckys</name>
    </filmmaker>
    <filmmaker id="FM2">
        <name>Steven Spielberg</name>
    </filmmaker>
    <filmmaker id="FM3">
        <name>Mary Harron</name>
    </filmmaker>
    <info>
        <important/>
        This films are really interesting
    </info>
</films>